numero,nombre,tipo1,tipo2,altura,peso,descripcion
1,Bulbasaur,Grass,Poison,7,69,A strange seed was planted on its back at birth  The plant sprouts and grows with this POKéMON 
2,Ivysaur,Grass,Poison,10,130,When the bulb on its back grows large  it appears to lose the ability to stand on its hind legs 
3,Venusaur,Grass,Poison,20,1000,The plant blooms when it is absorbing solar energy  It stays on the move to seek sunlight 
4,Charmander,Fire,,6,85,Obviously prefers hot places  When it rains  steam is said to spout from the tip of its tail 
5,Charmeleon,Fire,,11,190,When it swings its burning tail  it elevates the temperature to unbearably high levels 
6,Charizard,Fire,Flying,17,905,Spits fire that is hot enough to melt boulders  Known to cause forest fires unintentionally 
7,Squirtle,Water,,5,90,After birth  its back swells and hardens into a shell  Powerfully sprays foam from its mouth 
8,Wartortle,Water,,10,225,Often hides in water to stalk unwary prey  For swimming fast  it moves its ears to maintain balance 
9,Blastoise,Water,,16,855,A brutal POKéMON with pressurized water jets on its shell  They are used for high speed tackles 
10,Caterpie,Bug,,3,29,如果碰到牠頭上的觸角， 牠就會分泌強烈的臭味 來保護自己。
11,Metapod,Bug,,7,99,This POKéMON is vulnerable to attack while its shell is soft  exposing its weak and tender body 
12,Butterfree,Bug,Flying,11,320,In battle  it flaps its wings at high speed to release highly toxic dust into the air 
13,Weedle,Bug,Poison,3,32,Often found in forests  eating leaves  It has a sharp venomous stinger on its head 
14,Kakuna,Bug,Poison,6,100,Almost incapable of moving  this POKéMON can only harden its shell to protect itself from predators 
15,Beedrill,Bug,Poison,10,295,It has three poisonous stingers on its forelegs and its tail  They are used to jab its enemy repeatedly 
16,Pidgey,Normal,Flying,3,18,A common sight in forests and woods  It flaps its wings at ground level to kick up blinding sand 
17,Pidgeotto,Normal,Flying,11,300,Very protective of its sprawling territorial area  this POKéMON will fiercely peck at any intruder 
18,Pidgeot,Normal,Flying,15,395,When hunting  it skims the surface of water at high speed to pick off unwary prey such as MAGIKARP 
19,Rattata,Normal,,3,35,キバが２つ。とにかく　なんでも かじってみる。１ぴき　みつけたら ４０ぴきは　そこに　すんでるはず。
20,Raticate,Normal,,7,185,Ses pattes arrière lui permettent de traverser les rivières  Il est toujours en quête de nourriture 
21,Spearow,Normal,Flying,3,20,It flaps its small wings busily to fly  Using its beak  it searches in grass for prey 
22,Fearow,Normal,Flying,12,380,With its huge and magnificent wings  it can keep aloft without ever having to land for rest 
23,Ekans,Poison,,20,69,Moves silently and stealthily  Eats the eggs of birds  such as PIDGEY and SPEAROW  whole 
24,Arbok,Poison,,35,650,It is rumored that the ferocious warning markings on its belly differ from area to area 
25,Pikachu,Electric,,4,60,When several of these POKéMON gather  their electricity could build and cause lightning storms 
26,Raichu,Electric,,8,300,Its long tail serves as a ground to protect itself from its own high-voltage power 
27,Sandshrew,Ground,,6,120,Burrows deep underground in arid locations far from water  It only emerges to hunt for food 
28,Sandslash,Ground,,10,295,Curls up into a spiny ball when threatened  It can roll while curled up to attack or escape 
29,Nidoran-f,Poison,,4,70,Although small  its venomous barbs render this POKéMON dangerous  The female has smaller horns 
30,Nidorina,Poison,,8,200,The female's horn develops slowly  Prefers physical attacks such as clawing and biting 
31,Nidoqueen,Poison,Ground,13,600,Its hard scales provide strong protection  It uses its hefty bulk to execute powerful moves 
32,Nidoran-m,Poison,,5,90,Stiffens its ears to sense danger  The larger its horns  the more powerful its secreted venom 
33,Nidorino,Poison,,9,195,神經質且容易發脾氣打架。 當體內的腎上腺素增加時， 毒素的濃度也會提升。
34,Nidoking,Poison,Ground,14,620,It uses its powerful tail in battle to smash  constrict  then break the prey's bones 
35,Clefairy,Fairy,,6,75,Its magical and cute appeal has many admirers  It is rare and found only in certain areas 
36,Clefable,Fairy,,13,400,A timid fairy POKéMON that is rarely seen  It will run and hide the moment it senses people 
37,Vulpix,Fire,,6,99,At the time of birth  it has just one tail  The tail splits from its tip as it grows older 
38,Ninetales,Fire,,11,199,Very smart and very vengeful  Grabbing one of its many tails could result in a 1000-year curse 
39,Jigglypuff,Normal,Fairy,5,55,When its huge eyes light up  it sings a mysteriously soothing melody that lulls its enemies to sleep 
40,Wigglytuff,Normal,Fairy,10,120,The body is soft and rubbery  When angered  it will suck in air and inflate itself to an enormous size 
41,Zubat,Poison,Flying,8,75,因為沒有眼珠所以看不見東西。 會從口中發出超音波 來探測周圍的狀況。
42,Golbat,Poison,Flying,16,550,Once it strikes  it will not stop draining energy from the victim even if it gets too heavy to fly 
43,Oddish,Grass,Poison,5,54,During the day  it keeps its face buried in the ground  At night  it wanders around sowing its seeds 
44,Gloom,Grass,Poison,8,86,The fluid that oozes from its mouth isn't drool  It is a nectar that is used to attract prey 
45,Vileplume,Grass,Poison,12,186,It has the world’s largest petals  With every step  the petals shake out heavy clouds of toxic pollen 
46,Paras,Bug,Grass,3,54,Burrows to suck tree roots  The mushrooms on its back grow by draw­ ing nutrients from the bug host 
47,Parasect,Bug,Grass,10,295,A host-parasite pair in which the parasite mushroom has taken over the host bug  Prefers damp places 
48,Venonat,Bug,Poison,10,300,Lives in the shadows of tall trees where it eats insects  It is attracted by light at night 
49,Venomoth,Bug,Poison,15,125,The dustlike scales covering its wings are color-coded to indicate the kinds of poison it has 
50,Diglett,Ground,,2,8,피부가 매우 얇아서 빛을 쪼이게 되면 혈액이 데워져 약해진다 
51,Dugtrio,Ground,,7,333,A team of DIGLETT triplets  It triggers huge earthquakes by burrowing 60 miles underground 
52,Meowth,Normal,,4,42,It washes its face regularly to keep the coin on its forehead spotless  It doesn’t get along with Galarian Meowth 
53,Persian,Normal,,10,320,Although its fur has many admirers  it is tough to raise as a pet because of its fickle meanness 
54,Psyduck,Water,,8,196,While lulling its enemies with its vacant look  this wily POKéMON will use psychokinetic powers 
55,Golduck,Water,,17,766,Often seen swim­ ming elegantly by lake shores  It is often mistaken for the Japanese monster  Kappa 
56,Mankey,Fighting,,5,280,Extremely quick to anger  It could be docile one moment then thrashing away the next instant 
57,Primeape,Fighting,,10,320,Always furious and tenacious to boot  It will not abandon chasing its quarry until it is caught 
58,Growlithe,Fire,,7,190,Very protective of its territory  It will bark and bite to repel intruders from its space 
59,Arcanine,Fire,,19,1550,A POKéMON that has been admired since the past for its beauty  It runs agilely as if on wings 
60,Poliwag,Water,,6,124,Its newly grown legs prevent it from running  It appears to prefer swimming than trying to stand 
61,Poliwhirl,Water,,10,200,Capable of living in or out of water  When out of water  it sweats to keep its body slimy 
62,Poliwrath,Water,Fighting,13,540,An adept swimmer at both the front crawl and breast stroke  Easily overtakes the best human swimmers 
63,Abra,Psychic,,9,195,Using its ability to read minds  it will identify impending danger and TELEPORT to safety 
64,Kadabra,Psychic,,13,565,It emits special alpha waves from its body that induce headaches just by being close by 
65,Alakazam,Psychic,,15,480,Its brain can out­ perform a super­ computer  Its intelligence quotient is said to be 5 000 
66,Machop,Fighting,,8,195,Malgré sa petite taille  sa force lui permet de soulever plusieurs Racaillou à la fois 
67,Machoke,Fighting,,15,705,Its muscular body is so powerful  it must wear a power save belt to be able to regulate its motions 
68,Machamp,Fighting,,16,1300,Using its heavy muscles  it throws powerful punches that can send the victim clear over the horizon 
69,Bellsprout,Grass,Poison,7,40,A carnivorous POKéMON that traps and eats bugs  It uses its root feet to soak up needed moisture 
70,Weepinbell,Grass,Poison,10,64,It spits out POISONPOWDER to immobilize the enemy and then finishes it with a spray of ACID 
71,Victreebel,Grass,Poison,17,155,Dieses Pokémon soll in großen Kolonien tief im Dschungel leben  doch niemand kann dies bestätigen 
72,Tentacool,Water,Poison,9,455,Drifts in shallow seas  Anglers who hook them by accident are often punished by its stinging acid 
73,Tentacruel,Water,Poison,16,550,The tentacles are normally kept short  On hunts  they are extended to ensnare and immobilize prey 
74,Geodude,Rock,Ground,4,200,Found in fields and mountains  Mistaking them for boulders  people often step or trip on them 
75,Graveler,Rock,Ground,10,1050,De naturaleza descuidada y libre  no le importa dañarse cuando baja rodando montañas 
76,Golem,Rock,Ground,14,3000,Its boulder-like body is extremely hard  It can easily withstand dynamite blasts without damage 
77,Ponyta,Fire,,10,300,Its hooves are 10 times harder than diamonds  It can trample anything completely flat in little time 
78,Rapidash,Fire,,17,950,Galopa a casi 240 km por hora  Su crin ardiente parece una flecha cuando corre 
79,Slowpoke,Water,Psychic,12,360,Descansa ocioso junto al agua  Si algo muerde su cola  no lo notará en todo el día 
80,Slowbro,Water,Psychic,16,785,The SHELLDER that is latched onto SLOWPOKE's tail is said to feed on the host's left over scraps 
81,Magnemite,Electric,Steel,3,60,Uses anti-gravity to stay suspended  Appears without warning and uses THUNDER WAVE and similar moves 
82,Magneton,Electric,Steel,10,600,Formed by several MAGNEMITEs linked together  They frequently appear when sunspots flare up 
83,Farfetchd,Normal,Flying,8,150,The sprig of green onions it holds is its weapon  It is used much like a metal sword 
84,Doduo,Normal,Flying,14,392,A bird that makes up for its poor flying with its fast foot speed  Leaves giant footprints 
85,Dodrio,Normal,Flying,18,852,由嘟嘟的某个头分裂 出的变种。以60千米的 时速在草原上奔跑。
86,Seel,Water,,11,900,The protruding horn on its head is very hard  It is used for bashing through thick ice 
87,Dewgong,Water,Ice,17,1200,Stores thermal energy in its body  Swims at a steady 8 knots even in intensely cold waters 
88,Grimer,Poison,,9,300,Appears in filthy areas  Thrives by sucking up polluted sludge that is pumped out of factories 
89,Muk,Poison,,12,300,Thickly covered with a filthy  vile sludge  It is so toxic  even its footprints contain poison 
90,Shellder,Water,,3,40,Its hard shell repels any kind of attack  It is vulnerable only when its shell is open 
91,Cloyster,Water,Ice,15,1325,When attacked  it launches its horns in quick volleys  Its innards have never been seen 
92,Gastly,Ghost,Poison,13,1,Almost invisible  this gaseous POKéMON cloaks the target and puts it to sleep without notice 
93,Haunter,Ghost,Poison,16,1,Because of its ability to slip through block walls  it is said to be from an­ other dimension 
94,Gengar,Ghost,Poison,15,405,Under a full moon  this POKéMON likes to mimic the shadows of people and laugh at their fright 
95,Onix,Rock,Ground,88,2100,As it grows  the stone portions of its body harden to become similar to a diamond  but colored black 
96,Drowzee,Psychic,,10,324,Puts enemies to sleep then eats their dreams  Occasionally gets sick from eating bad dreams 
97,Hypno,Psychic,,16,756,When it locks eyes with an enemy  it will use a mix of PSI moves such as HYPNOSIS and CONFUSION 
98,Krabby,Water,,4,65,Its pincers are not only powerful weapons  they are used for balance when walking sideways 
99,Kingler,Water,,13,600,The large pincer has 10000 hp of crushing power  However  its huge size makes it unwieldy to use 
100,Voltorb,Electric,,5,104,Usually found in power plants  Easily mistaken for a POKé BALL  they have zapped many people 
101,Electrode,Electric,,12,666,It stores electric energy under very high pressure  It often explodes with little or no provocation 
102,Exeggcute,Grass,Psychic,4,25,Often mistaken for eggs  When disturbed  they quickly gather and attack in swarms 
103,Exeggutor,Grass,Psychic,20,1200,Legend has it that on rare occasions  one of its heads will drop off and continue on as an EXEGGCUTE 
104,Cubone,Ground,,4,65,Because it never removes its skull helmet  no one has ever seen this POKéMON's real face 
105,Marowak,Ground,,10,450,将骨头像回力镖一样扔出去， 击落天敌秃鹰娜来复仇。
106,Hitmonlee,Fighting,,15,498,When in a hurry  its legs lengthen progressively  It runs smoothly with extra long  loping strides 
107,Hitmonchan,Fighting,,14,502,While apparently doing nothing  it fires punches in lightning fast volleys that are impossible to see 
108,Lickitung,Normal,,12,655,Its tongue can be extended like a chameleon's  It leaves a tingling sensation when it licks enemies 
109,Koffing,Poison,,6,10,Because it stores several kinds of toxic gases in its body  it is prone to exploding without warning 
110,Weezing,Poison,,12,95,Where two kinds of poison gases meet  2 KOFFINGs can fuse into a WEEZING over many years 
111,Rhyhorn,Ground,Rock,10,1150,A POKéMON with a one-track mind  Once it charges   it won't stop running until it falls asleep 
112,Rhydon,Ground,Rock,19,1200,Protected by an armor-like hide  it is capable of living in molten lava of 3 600 degrees 
113,Chansey,Normal,,11,346,A rare and elusive POKéMON that is said to bring happiness to those who manage to get it 
114,Tangela,Grass,,10,350,The whole body is swathed with wide vines that are similar to sea­ weed  Its vines shake as it walks 
115,Kangaskhan,Normal,,22,800,The infant rarely ventures out of its mother's protective pouch until it is 3 years old 
116,Horsea,Water,,4,80,Known to shoot down flying bugs with precision blasts of ink from the surface of the water 
117,Seadra,Water,,12,250,Capable of swim­ ming backwards by rapidly flapping its wing-like pectoral fins and stout tail 
118,Goldeen,Water,,6,150,Its tail fin billows like an elegant ballroom dress  giving it the nickname of the Water Queen 
119,Seaking,Water,,13,390,In the autumn spawning season  they can be seen swimming powerfully up rivers and creeks 
120,Staryu,Water,,8,345,If its body is torn  it can grow back if the red core remains  The core flashes at midnight 
121,Starmie,Water,Psychic,11,800,Its central core glows with the seven colors of the rainbow  Some people value the core as a gem 
122,Mr-mime,Psychic,Fairy,13,545,If interrupted while it is miming  it will slap around the offender with its broad hands 
123,Scyther,Bug,Flying,15,560,With ninja-like agility and speed  it can create the illusion that there is more than one 
124,Jynx,Ice,Psychic,14,406,It seductively wiggles its hips as it walks  It can cause people to dance in unison with it 
125,Electabuzz,Electric,,11,300,Normally found near power plants  they can wander away and cause major blackouts in cities 
126,Magmar,Fire,,13,445,Its body always burns with an orange glow that enables it to hide perfectly among flames 
127,Pinsir,Bug,,15,550,If it fails to crush the victim in its pincers  it will swing it around and toss it hard 
128,Tauros,Normal,,14,884,When it targets an enemy  it charges furiously while whipping its body with its long tails 
129,Magikarp,Water,,9,100,In the distant past  it was somewhat stronger than the horribly weak descendants that exist today 
130,Gyarados,Water,Flying,65,2350,Once it begins to rampage  a GYARADOS will burn everything down  even in a harsh storm 
131,Lapras,Water,Ice,25,2200,A POKéMON that has been over­ hunted almost to extinction  It can ferry people across the water 
132,Ditto,Normal,,3,40,Capable of copying an enemy's genetic code to instantly transform itself into a duplicate of the enemy 
133,Eevee,Normal,,3,65,Its genetic code is irregular  It may mutate if it is exposed to radiation from element STONEs 
134,Vaporeon,Water,,10,290,Lives close to water  Its long tail is ridged with a fin which is often mistaken for a mermaid's 
135,Jolteon,Electric,,8,245,It accumulates negative ions in the atmosphere to blast out 10000- volt lightning bolts 
136,Flareon,Fire,,9,250,When storing thermal energy in its body  its temperature could soar to over 1600 degrees 
137,Porygon,Normal,,8,365,A POKéMON that consists entirely of programming code  Capable of moving freely in cyberspace 
138,Omanyte,Rock,Water,4,75,Although long extinct  in rare cases  it can be genetically resurrected from fossils 
139,Omastar,Rock,Water,10,350,A prehistoric POKéMON that died out when its heavy shell made it impossible to catch prey 
140,Kabuto,Rock,Water,5,115,A POKéMON that was resurrected from a fossil found in what was once the ocean floor eons ago 
141,Kabutops,Rock,Water,13,405,È un perfetto nuotatore  Taglia la preda con le sue falci e ne succhia il sangue 
142,Aerodactyl,Rock,Flying,18,590,A Pokémon that roamed the skies in the dinosaur era  Its teeth are like saw blades 
143,Snorlax,Normal,,21,4600,Very lazy  Just eats and sleeps  As its rotund bulk builds  it becomes steadily more slothful 
144,Articuno,Ice,Flying,17,554,A legendary bird POKéMON that is said to appear to doomed people who are lost in icy mountains 
145,Zapdos,Electric,Flying,16,526,かみなりぐもの　なかに　いると いわれる　でんせつの　ポケモン。 カミナリを　じざいに　あやつる。
146,Moltres,Fire,Flying,20,600,Known as the legendary bird of fire  Every flap of its wings creates a dazzling flash of flames 
147,Dratini,Dragon,,18,33,Long considered a mythical POKéMON until recently when a small colony was found living underwater 
148,Dragonair,Dragon,,40,165,人们相信它能操纵天气， 所以在哈克龙栖息的湖里， 供品总是源源不断。
149,Dragonite,Dragon,Flying,22,2100,An extremely rarely seen marine POKéMON  Its intelligence is said to match that of humans 
150,Mewtwo,Psychic,,20,1220,It was created by a scientist after years of horrific gene splicing and DNA engineering experiments 
151,Mew,Psychic,,4,40,So rare that it is still said to be a mirage by many experts  Only a few people have seen it worldwide 
152,Chikorita,Grass,,9,64,A sweet aroma gently wafts from the leaf on its head  It is docile and loves to soak up the sun's rays 
153,Bayleef,Grass,,12,158,The scent of spices comes from around its neck  Somehow  sniffing it makes you want to fight 
154,Meganium,Grass,,18,1005,The aroma that rises from its petals contains a substance that calms aggressive feelings 
155,Cyndaquil,Fire,,5,79,It has a timid nature  If it is startled  the flames on its back burn more vigorously 
156,Quilava,Fire,,9,190,Be careful if it turns its back during battle  It means that it will attack with the fire on its back 
157,Typhlosion,Fire,,17,795,If its rage peaks  it becomes so hot that anything that touches it will instantly go up in flames 
158,Totodile,Water,,6,95,Its well-developed jaws are powerful and capable of crushing anything  Even its trainer must be careful 
159,Croconaw,Water,,11,250,If it loses a fang  a new one grows back in its place  There are always 48 fangs lining its mouth 
160,Feraligatr,Water,,23,888,When it bites with its massive and powerful jaws  it shakes its head and savagely tears its victim up 
161,Sentret,Normal,,8,60,A very cautious POKéMON  it raises itself up using its tail to get a better view of its surroundings 
162,Furret,Normal,,18,325,It makes a nest to suit its long and skinny body  The nest is impossible for other POKéMON to enter 
163,Hoothoot,Normal,Flying,7,212,It always stands on one foot  It changes feet so fast  the movement can rarely be seen 
164,Noctowl,Normal,Flying,16,408,Its eyes are specially adapted  They concentrate even faint light and enable it to see in the dark 
165,Ledyba,Bug,Flying,10,108,It is very timid  It will be afraid to move if it is alone  But it will be active if it is in a group 
166,Ledian,Bug,Flying,14,356,When the stars flicker in the night sky  it flutters about  scattering a glowing powder 
167,Spinarak,Bug,Poison,5,85,It lies still in the same pose for days in its web  waiting for its unsuspecting prey to wander close 
168,Ariados,Bug,Poison,11,335,也有地区会使用 阿利多斯的丝来织布。 因布料结实而广受好评。
169,Crobat,Poison,Flying,18,750,It flies so si­ lently through the dark on its four wings that it may not be noticed even when nearby 
170,Chinchou,Water,Electric,5,120,Chinchou blink their shining antennae at one another to claim their respective turf 
171,Lanturn,Water,Electric,12,225,The light it emits is so bright that it can illuminate the sea's surface from a depth of over three miles 
172,Pichu,Electric,,3,20,It is not yet skilled at storing electricity  It may send out a jolt if amused or startled 
173,Cleffa,Fairy,,3,30,Because of its unusual  star-like silhouette  people believe that it came here on a meteor 
174,Igglybuff,Normal,Fairy,3,10,It has a very soft body  If it starts to roll  it will bounce all over and be impossible to stop 
175,Togepi,Fairy,,3,15,The shell seems to be filled with joy  It is said that it will share good luck when treated kindly 
176,Togetic,Fairy,Flying,6,32,They say that it will appear before kindhearted  car­ ing people and shower them with happiness 
177,Natu,Psychic,Flying,2,20,Because its wings aren't yet fully grown  it has to hop to get around  It is always star­ ing at something 
178,Xatu,Psychic,Flying,15,150,They say that it stays still and quiet because it is seeing both the past and future at the same time 
179,Mareep,Electric,,6,78,If static elec­ tricity builds in its body  its fleece doubles in volume  Touching it will shock you 
180,Flaaffy,Electric,,8,133,푹신푹신한 털은 전기를 모으기 쉽지만 고무 같은 피부 덕분에 자신은 마비되지 않는다 
181,Ampharos,Electric,,14,615,The tail's tip shines brightly and can be seen from far away  It acts as a beacon for lost people 
182,Bellossom,Grass,,4,58,Plentiful in the tropics  When it dances  its petals rub together and make a pleasant ringing sound 
183,Marill,Water,Fairy,4,85,The tip of its tail  which con­ tains oil that is lighter than wa­ ter  lets it swim without drowning 
184,Azumarill,Water,Fairy,8,285,It lives in water virtually all day long  Its body color and pattern act as camouflage that makes it tough for enemies to spot in water 
185,Sudowoodo,Rock,,12,380,Although it always pretends to be a tree  its composi­ tion appears to be closer to a rock than a plant 
186,Politoed,Water,,11,339,If POLIWAG and POLIWHIRL hear its echoing cry  they respond by gather­ ing from far and wide 
187,Hoppip,Grass,Flying,4,5,To keep from being blown away by the wind  they gather in clusters  They do enjoy gentle breezes  though 
188,Skiploom,Grass,Flying,6,10,The bloom on top of its head opens and closes as the temperature fluc­ tuates up and down 
189,Jumpluff,Grass,Flying,8,30,Once it catches the wind  it deft­ ly controls its cotton-puff spores to float  even around the world 
190,Aipom,Normal,,8,115,Sa queue est aussi agile que ses mains  Il vit en haut des grands arbres 
191,Sunkern,Grass,,3,18,It may drop out of the sky suddenly  If attacked by a SPEAROW  it will violently shake its leaves 
192,Sunflora,Grass,,8,85,It converts sun­ light into energy  In the darkness after sunset  it closes its petals and becomes still 
193,Yanma,Bug,Flying,12,380,If it flaps its wings really fast  it can generate shock waves that will shatter win­ dows in the area 
194,Wooper,Water,Ground,4,85,This POKéMON lives in cold water  It will leave the water to search for food when it gets cold outside 
195,Quagsire,Water,Ground,14,750,This carefree POKéMON has an easy-going nature  While swimming  it always bumps into boat hulls 
196,Espeon,Psychic,,9,265,It uses the fine hair that covers its body to sense air currents and predict its ene­ my's actions 
197,Umbreon,Dark,,10,270,When agitated  this POKéMON pro­ tects itself by spraying poisonous sweat from its pores 
198,Murkrow,Dark,Flying,5,21,Feared and loathed by many  it is believed to bring misfortune to all those who see it at night 
199,Slowking,Water,Psychic,20,795,It has incredible intellect and in­ tuition  Whatever the situation  it remains calm and collected 
200,Misdreavus,Ghost,,7,10,It likes playing mischievous tricks such as screaming and wailing to startle people at night 
201,Unown,Psychic,,5,50,Their shapes look like hieroglyphs on ancient tab­ lets  It is said that the two are somehow related 
202,Wobbuffet,Psychic,,13,285,Odia la luz y las sacudidas  Si le atacan  infla su cuerpo para aumentar su contraataque 
203,Girafarig,Normal,Psychic,15,415,Its tail has a small brain of its own  Beware! If you get close  it may react to your scent and bite 
204,Pineco,Bug,,6,72,It likes to make its shell thicker by adding layers of tree bark  The additional weight doesn't bother it 
205,Forretress,Bug,Steel,12,1258,Its entire body is shielded by a steel-hard shell  What lurks inside the armor is a total mystery 
206,Dunsparce,Normal,,15,140,When spotted  this POKéMON escapes backward by furi­ ously boring into the ground with its tail 
207,Gligar,Ground,Flying,11,648,It flies straight at its target's face then clamps down on the star­ tled victim to inject poison 
208,Steelix,Steel,Ground,92,4000,It is thought its body transformed as a result of iron accumulating internally from swallowing soil 
