numero,nombre,tipo1,tipo2,altura,peso,descripcion
358,Chimecho,Psychic,,6,10,CHIMECHO makes its cries echo inside its hollow body  When this POKéMON becomes enraged  its cries result in ultrasonic waves that have the power to knock foes flying 
359,Absol,Dark,,12,470,Every time ABSOL appears before people  it is followed by a disaster such as an earthquake or a tidal wave  As a result  it came to be known as the disaster POKéMON 
360,Wynaut,Psychic,,6,140,WYNAUT can always be seen with a big  happy smile on its face  Look at its tail to determine if it is angry  When angered  this POKéMON will be slapping the ground with its tail 
361,Snorunt,Ice,,7,168,SNORUNT live in regions with heavy snowfall  In seasons without snow  such as spring and summer  this POKéMON steals away to live quietly among stalactites and stalagmites deep in caverns 
362,Glalie,Ice,,15,2565,GLALIE has a body made of rock  which it hardens with an armor of ice  This POKéMON has the ability to freeze moisture in the atmosphere into any shape it desires 
363,Spheal,Ice,Water,8,395,SPHEAL is much faster rolling than  walking to get around  When groups of this POKéMON eat  they all clap at once to show their pleasure  Because of this  their mealtimes are noisy 
364,Sealeo,Ice,Water,11,876,SEALEO has the habit of always juggling on the tip of its nose anything it sees for the first time  This POKéMON occasionally entertains itself by balancing and rolling a SPHEAL on its nose 
365,Walrein,Ice,Water,14,1506,It swims through icy seas while shattering ice floes with its large tusks  It is protected by its thick blubber 
366,Clamperl,Water,,4,525,CLAMPERL’s sturdy shell is not only good for protection - it is also used for clamping and catching prey  A fully grown CLAMPERL’s shell will be scored with nicks and scratches all over 
367,Huntail,Water,,17,270,HUNTAIL’s presence went unnoticed by people for a long time because it lives at extreme depths in the sea  This POKéMON’s eyes can see clearly even in the murky dark depths of the ocean 
368,Gorebyss,Water,,18,226,헤엄치는 모습이 굉장히 우아하다  가는 입으로 바위 틈새에 나 있는 해초를 먹는다 
369,Relicanth,Water,Rock,10,234,RELICANTH is a POKéMON species that existed for a hundred million years without ever changing its form  This ancient POKéMON feeds on microscopic organisms with its toothless mouth 
370,Luvdisc,Water,,6,87,LUVDISC live in shallow seas in the tropics  This heart-shaped POKéMON earned its name by swimming after loving couples it spotted in the ocean’s waves 
371,Bagon,Dragon,,6,421,Dreaming of one day flying  it practices by leaping off cliffs every day 
372,Shelgon,Dragon,,11,1105,Inside SHELGON’s armor-like shell  cells are in the midst of transformation to create an entirely new body  This POKéMON’s shell is extremely heavy  making its movements sluggish 
373,Salamence,Dragon,Flying,15,1026,SALAMENCE came about as a result of a strong  long-held dream of growing wings  It is said that this powerful desire triggered a sudden mutation in this POKéMON’s cells  causing it to sprout its magnificent wings 
374,Beldum,Steel,Psychic,6,952,Il dégage un champ magnétique opposé à celui de la terre  ce qui lui permet de léviter 
375,Metang,Steel,Psychic,12,2025,When two BELDUM fuse together  METANG is formed  The brains of the BELDUM are joined by a magnetic nervous system  By linking its brains magnetically  this POKéMON generates strong psychokinetic power 
376,Metagross,Steel,Psychic,16,5500,METAGROSS has four brains in total  Combined  the four brains can breeze through difficult calculations faster than a supercomputer  This POKéMON can float in the air by tucking in its four legs 
377,Regirock,Rock,,17,2300,Its entire body is made of rock  If any part chips off in battle  it attaches rocks to repair itself 
378,Regice,Ice,,18,1750,REGICE’s body was made during an ice age  The deep-frozen body can’t be melted  even by fire  This POKéMON controls frigid air of minus 328 degrees F 
379,Registeel,Steel,,19,2050,REGISTEEL has a body that is harder than any kind of metal  Its body is apparently hollow  No one has any idea what this POKéMON eats 
380,Latias,Dragon,Psychic,14,400,LATIAS is highly sensitive to the emotions of people  If it senses any hostility  this POKéMON ruffles the feathers all over its body and cries shrilly to intimidate the foe 
381,Latios,Dragon,Psychic,20,600,LATIOS has the ability to make its foe see an image of what it has seen or imagines in its head  This POKéMON is intelligent and understands human speech 
382,Kyogre,Water,,45,3520,KYOGRE has the power to create massive rain clouds that cover the entire sky and bring about torrential downpours  This POKéMON saved people who were suffering from droughts 
383,Groudon,Ground,,35,9500,Dicen que este Pokémon legendario simboliza la tierra  Tras batirse en duelo con Kyogre se echó a dormir 
384,Rayquaza,Dragon,Flying,70,2065,RAYQUAZA lived for hundreds of millions of years in the earth’s ozone layer   never descending to the ground  This POKéMON appears to feed on water and particles in the atmosphere 
385,Jirachi,Steel,Psychic,3,11,A legend states that JIRACHI will make true any wish that is written on notes attached to its head when it awakens  If this POKéMON senses danger  it will fight without awakening 
386,Deoxys-normal,Psychic,,17,608,The DNA of a space virus underwent a sudden mutation upon exposure to a laser beam and resulted in DEOXYS  The crystalline organ on this POKéMON’s chest appears to be its brain 
387,Turtwig,Grass,,4,102,Made from soil  the shell on its back hardens when it drinks water  It lives along lakes 
388,Grotle,Grass,,11,970,It knows where pure water wells up  It carries fellow Pokémon there on its back 
389,Torterra,Grass,Ground,22,3100,Small Pokémon occasionally gather on its unmoving back to begin building their nests 
390,Chimchar,Fire,,5,62,It agilely scales sheer cliffs to live atop craggy mountains  Its fire is put out when it sleeps 
391,Monferno,Fire,Fighting,9,220,To intimidate attackers  it stretches the fire on its tail to make itself appear bigger 
392,Infernape,Fire,Fighting,12,550,It uses a special kind of martial arts involving all its limbs  Its fire never goes out 
393,Piplup,Water,,4,52,Because it is very proud  it hates accepting food from people  Its thick down guards it from cold 
394,Prinplup,Water,,8,230,It lives alone  away from others  Apparently  every one of them believes it is the most important 
395,Empoleon,Water,Steel,17,845,The three horns that extend from its beak attest to its power  The leader has the biggest horns 
396,Starly,Normal,Flying,3,20,They flock in great numbers  Though small  they flap their wings with great power 
397,Staravia,Normal,Flying,6,155,It flies around forests and fields in search of bug Pokémon  It stays within a huge flock 
398,Staraptor,Normal,Flying,12,249,It has a savage nature  It will courageously challenge foes that are much larger 
399,Bidoof,Normal,,5,200,With nerves of steel  nothing can perturb it  It is more agile and active than it appears 
400,Bibarel,Normal,Water,10,315,It makes its nest by damming streams with bark and mud  It is known as an industrious worker 
401,Kricketot,Bug,,3,22,It shakes its head back to front  causing its antennae to hit each other and sound like a xylophone 
402,Kricketune,Bug,,10,255,It crosses its knifelike arms in front of its chest when it cries  It can compose melodies ad lib 
403,Shinx,Electric,,5,95,All of its fur dazzles if danger is sensed  It flees while the foe is momentarily blinded 
404,Luxio,Electric,,9,305,遇到敌人时会从脚 伸出有着百万伏特 威力的爪子来迎战。
405,Luxray,Electric,,14,420,It has eyes that can see through anything  It spots and captures prey hiding behind objects 
406,Budew,Grass,Poison,2,12,Over the winter  it closes its bud and endures the cold  In spring  the bud opens and releases pollen 
407,Roserade,Grass,Poison,9,145,Con i movimenti di una ballerina  colpisce con le fruste  piene di spine velenose 
408,Cranidos,Rock,,9,315,It lived in jungles around 100 million years ago  Its skull is as hard as iron 
409,Rampardos,Rock,,16,1025,Its powerful head butt has enough power to shatter even the most durable things upon impact 
410,Shieldon,Rock,Steel,5,570,A Pokémon that lived in jungles around 100 million years ago  Its facial hide is extremely hard 
411,Bastiodon,Rock,Steel,13,1495,Any frontal attack is repulsed  It is a docile Pokémon that feeds on grass and berries 
412,Burmy,Bug,,2,34,To shelter itself from cold  wintry winds  it covers itself with a cloak made of twigs and leaves 
413,Wormadam-plant,Bug,Grass,5,65,When BURMY evolved  its cloak became a part of this Pokémon’s body  The cloak is never shed 
414,Mothim,Bug,Flying,9,233,It loves the honey of flowers and steals honey collected by COMBEE 
415,Combee,Bug,Flying,3,55,A Pokémon formed by three others  It busily carries sweet floral honey to VESPIQUEN 
416,Vespiquen,Bug,Flying,12,385,Its abdomen is a honeycomb for grubs  It raises its grubs on honey collected by COMBEE 
417,Pachirisu,Electric,,4,39,It makes fur balls that crackle with static electricity  It stores them with berries in tree holes 
418,Buizel,Water,,7,295,It has a flotation sac that is like an inflatable collar  It floats on water with its head out 
419,Floatzel,Water,,11,335,It floats using its well-developed flotation sac  It assists in the rescues of drowning people 
420,Cherubi,Grass,,4,33,栄養の　詰まった　玉は 鳥ポケモンの　大好物。 ついばまれないよう　逃げまわる。
421,Cherrim,Grass,,5,93,It blooms during times of strong sunlight  It tries to make up for everything it endured as a bud 
422,Shellos,Water,,3,63,Its colors and shapes differ from region to region  In the Sinnoh region  two types are confirmed 
423,Gastrodon,Water,Ground,9,299,Attaqué par un prédateur  il fuit en libérant un liquide mauve 
424,Ambipom,Normal,,12,203,To eat  it deftly shucks nuts with its two tails  It rarely uses its arms now 
425,Drifloon,Ghost,Flying,4,12,A Pokémon formed by the spirits of people and Pokémon  It loves damp  humid seasons 
426,Drifblim,Ghost,Flying,12,150,At dusk  swarms of them are carried aloft on winds  When noticed  they suddenly vanish 
427,Buneary,Normal,,4,55,It slams foes by sharply uncoiling its rolled ears  It stings enough to make a grown-up cry in pain 
428,Lopunny,Normal,,12,333,An extremely cautious Pokémon  It cloaks its body with its fluffy ear fur when it senses danger 
429,Mismagius,Ghost,,9,44,Its cries sound like incantations  Those hearing it are tormented by headaches and hallucinations 
430,Honchkrow,Dark,Flying,9,273,Becoming active at night  it is known to swarm with numerous MURKROW in tow 
431,Glameow,Normal,,5,39,It claws if displeased and purrs when affectionate  Its fickleness is very popular among some 
432,Purugly,Normal,,10,438,It is a brazen brute that barges its way into another Pokémon’s nest and claims it as its own 
433,Chingling,Psychic,,2,6,It emits cries by agitating an orb at the back of its throat  It moves with flouncing hops 
434,Stunky,Poison,Dark,4,192,It protects itself by spraying a noxious fluid from its rear  The stench lingers for 24 hours 
435,Skuntank,Poison,Dark,10,380,It sprays a vile-smelling fluid from the tip of its tail to attack  Its range is over 160 feet 
436,Bronzor,Steel,Psychic,5,605,Se dice que brilla y refleja la verdad al pulirlo  aunque es algo que detesta 
437,Bronzong,Steel,Psychic,13,1870,One caused a news sensation when it was dug up at a construction site after a 2 000-year sleep 
438,Bonsly,Rock,,5,150,It looks as if it is always crying  It is actually adjusting its body’s fluid levels by eliminating excess 
439,Mime-jr,Psychic,Fairy,6,130,It habitually mimics foes  Once mimicked  the foe cannot take its eyes off this Pokémon 
440,Happiny,Normal,,6,244,It loves round white things  It carries an egg-shaped rock in imitation of CHANSEY 
441,Chatot,Normal,Flying,5,19,It can learn and speak human words  If they gather  they all learn the same saying 
442,Spiritomb,Ghost,Dark,10,1080,A Pokémon that was formed by 108 spirits  It is bound to a fissure in an odd keystone 
443,Gible,Dragon,Ground,7,205,It nests in small  horizontal holes in cave walls  It pounces to catch prey that stray too close 
444,Gabite,Dragon,Ground,14,560,There is a long-held belief that medicine made from its scales will heal even incurable illnesses 
445,Garchomp,Dragon,Ground,19,950,When it folds up its body and extends its wings  it looks like a jet plane  It flies at sonic speed 
446,Munchlax,Normal,,6,1050,It wolfs down its weight in food once a day  swallowing food whole with almost no chewing 
447,Riolu,Fighting,,7,202,The aura that emanates from its body intensifies to alert others if it is afraid or sad 
448,Lucario,Fighting,Steel,12,540,It has the ability to sense the auras of all things  It understands human speech 
449,Hippopotas,Ground,,8,495,It lives in arid places  Instead of perspiration  it expels grainy sand from its body 
450,Hippowdon,Ground,,20,3000,It blasts internally stored sand from ports on its body to create a towering twister for attack 
451,Skorupi,Poison,Bug,8,120,It grips prey with its tail claws and injects poison  It tenaciously hangs on until the poison takes 
452,Drapion,Poison,Dark,13,615,It has the power in its clawed arms to make scrap of a car  The tips of its claws release poison 
453,Croagunk,Poison,Fighting,7,230,Its cheeks hold poison sacs  It tries to catch foes off guard to jab them with toxic fingers 
454,Toxicroak,Poison,Fighting,13,444,Its knuckle claws secrete a toxin so vile that even a scratch could prove fatal 
455,Carnivine,Grass,,14,270,It attracts prey with its sweet- smelling saliva  then chomps down  It takes a whole day to eat prey 
456,Finneon,Water,,4,70,Die Linie an seiner Seite kann Sonnenlicht speichern  Nachts leuchtet es sehr intensiv 
457,Lumineon,Water,,12,240,Il vit au plus profond de l’océan  Il attire sa proie en illuminant les motifs de ses quatre nageoires 
458,Mantyke,Water,Flying,10,650,A friendly Pokémon that captures the subtle flows of seawater using its two antennae 
459,Snover,Grass,Ice,10,505,It lives on snowy mountains  Having had little contact with humans  it is boldly inquisitive 
460,Abomasnow,Grass,Ice,22,1355,It whips up blizzards in mountains that are always buried in snow  It is the abominable snowman 
461,Weavile,Dark,Ice,11,340,They live in cold regions  forming groups of four or five that hunt prey with impressive coordination 
462,Magnezone,Electric,Steel,12,1800,It evolved from exposure to a special magnetic field  Three units generate magnetism 
463,Lickilicky,Normal,,17,1400,타액에는 어떤 것도 녹이는 성분이 충분히 포함되어 있어 핥으면 언제까지나 마비된다 
464,Rhyperior,Ground,Rock,24,2828,It puts rocks in holes in its palms and uses its muscles to shoot them  GEODUDE are shot at rare times 
465,Tangrowth,Grass,,20,1286,It ensnares prey by extending arms made of vines  Losing arms to predators does not trouble it 
466,Electivire,Electric,,18,1386,As its electric charge amplifies  blue sparks begin to crackle between its horns 
467,Magmortar,Fire,,16,680,It blasts fireballs of over 3 600 degrees F from the ends of its arms  It lives in volcanic craters 
468,Togekiss,Fairy,Flying,15,380,Es zeigt sich nie an Orten  wo Streit und Zwietracht herrschen  In letzter Zeit wird es kaum noch gesehen 
469,Yanmega,Bug,Flying,19,515,By churning its wings  it creates shock waves that inflict critical internal injuries to foes 
470,Leafeon,Grass,,10,255,Just like a plant  it uses photosynthesis  As a result  it is always enveloped in clear air 
471,Glaceon,Ice,,8,259,As a protective technique  it can completely freeze its fur to make its hairs stand like needles 
472,Gliscor,Ground,Flying,20,425,It observes prey while hanging inverted from branches  When the chance presents itself  it swoops!
473,Mamoswine,Ice,Ground,25,2910,Its impressive tusks are made of ice  The population thinned when it turned warm after the ice age 
474,Porygon-z,Normal,,9,340,Additional software was installed to make it a better Pokémon  It began acting oddly  however 
475,Gallade,Psychic,Fighting,16,520,Comme il peut lire les pensées de ses adversaires  il frappe toujours en premier 
476,Probopass,Rock,Steel,14,3400,It freely controls three small units called Mini-Noses using magnetic force 
477,Dusknoir,Ghost,,22,1066,Die Antenne auf seinem Kopf empfängt Radiowellen aus einer anderen Dimension 
478,Froslass,Ice,Ghost,13,266,It freezes foes with an icy breath nearly -60 degrees F  What seems to be its body is actually hollow 
479,Rotom,Electric,Ghost,3,3,某位少年的发明 促使人们开始制造 各种活用洛托姆的机器 。
480,Uxie,Psychic,,3,3,Known as “The Being of Knowledge ” It is said that it can wipe out the memory of those who see its eyes 
481,Mesprit,Psychic,,3,3,Known as “The Being of Emotion ” It taught humans the nobility of sorrow  pain  and joy 
482,Azelf,Psychic,,3,3,Known as “The Being of Willpower ” It sleeps at the bottom of a lake to keep the world in balance 
483,Dialga,Steel,Dragon,54,6830,It has the power to control time  It appears in Sinnoh-region myths as an ancient deity 
484,Palkia,Water,Dragon,42,3360,It has the ability to distort space  It is described as a deity in Sinnoh-region mythology 
485,Heatran,Fire,Steel,17,4300,It dwells in volcanic caves  It digs in with its cross-shaped feet to crawl on ceilings and walls 
486,Regigigas,Normal,,37,4200,There is an enduring legend that states this Pokémon towed continents with ropes 
487,Giratina-altered,Ghost,Dragon,45,7500,A Pokémon that is said to live in a world on the reverse side of ours  It appears in an ancient cemetery 
488,Cresselia,Psychic,,15,856,Shiny particles are released from its wings like a veil  It is said to represent the crescent moon 
489,Phione,Water,,4,31,Si sposta nei mari caldi  Torna sempre dove è nato  anche se si trova molto lontano 
490,Manaphy,Water,,3,14,Born on a cold seafloor  it will swim great distances to return to its birthplace 
491,Darkrai,Dark,,15,505,It can lull people to sleep and make them dream  It is active during nights of the new moon 
492,Shaymin-land,Grass,,2,21,Puede disolver las toxinas del aire para transformar tierra yerma en campos de flores 
493,Arceus,Normal,,32,3200,It is described in mythology as the Pokémon that shaped the universe with its 1 000 arms 
494,Victini,Psychic,Fire,4,40,Un Pokémon qui amène la victoire  On dit que les Dresseurs qui le possèdent peuvent gagner n’importe quel combat 
495,Snivy,Grass,,6,81,Un Pokémon intelligent et très calme  Lorsqu’il a reçu suffisamment de lumière du soleil  il devient plus agile 
496,Servine,Grass,,8,160,Il court comme s’il glissait sur le sol  Il déroute l’ennemi par ses mouvements et l’assomme d’un coup de liane 
497,Serperior,Grass,,33,630,Il peut paralyser l’ennemi d’un regard  Il amplifie l’énergie du soleil dans son corps 
498,Tepig,Fire,,5,99,Il évite agilement les attaques ennemies et crache des boules de feu par le groin  Il aime griller des Baies pour les manger 
499,Pignite,Fire,Fighting,10,555,Quand le feu dans son corps s’embrase  sa vitesse et son agilité augmentent  En cas d’urgence  il crache de la fumée 
500,Emboar,Fire,Fighting,16,1500,Il embrase ses poings avec les flammes sur son menton et cogne l’ennemi avec  C’est un Pokémon très solidaire 
501,Oshawott,Water,,5,59,Il combat avec le coupillage de son ventre  Il peut parer un assaut et immédiatement contre-attaquer 
502,Dewott,Water,,8,245,L’apprentissage de sa technique de combat  qui utilise élégamment ses deux coupillages  est extrêmement rigoureux 
503,Samurott,Water,,15,946,Il peut terrasser ses ennemis d’un coup de la lame enchâssée dans son armure  et les faire taire d’un seul regard 
504,Patrat,Normal,,5,116,Ils stockent à manger dans leurs bajoues et font le guet indéfiniment  Ils se font des signes en remuant la queue 
505,Watchog,Normal,,11,270,Il attaque en crachant les graines des Baies qu’il accumule dans ses bajoues  S’il voit un ennemi  il dresse la queue 
506,Lillipup,Normal,,4,41,Il fait vaillamment face à des ennemis très puissants  mais il est intelligent et évite les combats trop inégaux 
507,Herdier,Normal,,9,147,Les poils qui entourent son corps comme un manteau sont extrêmement durs et amortissent les coups 
508,Stoutland,Normal,,12,610,Il sauve les gens bloqués dans les montagnes par des tempêtes de neige  Ses longs poils le protègent du froid 
509,Purrloin,Dark,,4,101,Il vole les gens pour le plaisir  mais il est tellement mignon que ses victimes finissent toujours par lui pardonner 
510,Liepard,Dark,,11,375,Un Pokémon insaisissable  Son style et son pelage magnifique attirent de nombreux Dresseurs 
511,Pansage,Grass,,6,105,Il vit dans les forêts profondes  Manger la feuille qui pousse sur sa tête fait disparaître la fatigue 
512,Simisage,Grass,,11,305,Il a un tempérament violent et se bat avec sa queue pleine d’épines  La feuille sur sa tête est très amère 
513,Pansear,Fire,,6,110,Quand il s’énerve  la mèche sur sa tête chauffe à 300 °C  Il s’en sert pour griller des Baies et les manger 
514,Simisear,Fire,,10,280,Il adore les aliments sucrés  Ils lui servent d’énergie pour alimenter le feu à l’intérieur de son corps 
515,Panpour,Water,,6,135,L’eau contenue dans la mèche sur sa tête est pleine de nutriments  Elle fait pousser les plantes avec vigueur 
516,Simipour,Water,,10,290,Il stocke de l’eau dans les mèches de sa tête  Quand il est à sec  il se ravitaille en aspirant de l’eau par la queue 
517,Munna,Psychic,,6,233,Quand Munna mange un rêve  celui-ci est aussitôt oublié par le rêveur  Il lévite en permanence 
518,Musharna,Psychic,,11,605,La fumée qui sort de son front contient les rêves de nombreuses personnes et ceux de nombreux Pokémon 
519,Pidove,Normal,Flying,3,21,Il suit scrupuleusement les consignes de son Dresseur  mais il a du mal à comprendre les ordres trop compliqués 
520,Tranquill,Normal,Flying,6,150,Aussi éloigné qu’il puisse se trouver  il parvient toujours à retourner auprès de son Dresseur 
521,Unfezant,Normal,Flying,12,290,Le mâle intimide ses ennemis avec ses caroncules  La femelle vole mieux que le mâle 
522,Blitzle,Electric,,8,298,When thunderclouds cover the sky  it will appear  It can catch lightning with its mane and store the electricity 
523,Zebstrika,Electric,,16,795,Il réagit à la vitesse de l’éclair  Lorsqu’il est en plein galop  on peut entendre le grondement du tonnerre 
524,Roggenrola,Rock,,4,180,Il a une oreille hexagonale  Son corps  compressé dans des strates profondes  est dur comme de l’acier 
525,Boldore,Rock,,9,1020,Quand il est gonflé à bloc  ses cristaux orangés scintillent  Il cherche de l’eau souterraine dans les grottes 
526,Gigalith,Rock,,17,2600,Il comprime de l’énergie dans son corps  et ses attaques sont assez puissantes pour renverser des montagnes 
527,Woobat,Psychic,Flying,4,21,Il vit dans les forêts sombres et les grottes  Il émet des ultrasons par le nez pour se diriger 
528,Swoobat,Psychic,Flying,9,105,コンクリートも　こわせるほどの つよい　ちょうおんぱを　だすとき しっぽが　はげしく　ふるえる。
529,Drilbur,Ground,,3,85,Il peut creuser à plus de 50 km/h et faire la course avec une voiture roulant sur le terrain qu’il creuse 
530,Excadrill,Ground,Steel,7,404,Ses vrilles en acier peuvent transpercer des poutres en fer  Il est très employé dans la construction de tunnels 
531,Audino,Normal,,11,310,Il ausculte les gens avec ses antennes auriculaires pour juger de leurs émotions ou de leur santé 
532,Timburr,Fighting,,6,125,Il combat avec une poutre  Quand il en arrive à transporter de lourds madriers sans problème  l’évolution est proche 
533,Gurdurr,Fighting,,12,400,Même une armée de catcheurs se jetant sur son corps hyper musclé ne le ferait pas ciller 
534,Conkeldurr,Fighting,,14,870,On pense que la recette du ciment a été enseignée aux humains par un Bétochef il y a 2 000 ans 
535,Tympole,Water,,5,45,Il prévient ses camarades du danger en faisant vibrer ses joues pour générer un signal d’alarme très aigu 
536,Palpitoad,Water,Ground,8,170,Quand il fait vibrer la bosse sur sa tête  il provoque des ondulations dans l’eau  mais aussi des tremblements de terre 
537,Seismitoad,Water,Ground,15,620,Il fait gicler un liquide paralysant des pustules sur sa tête  et attaque ses ennemis à coups de vibrations 
538,Throh,Fighting,,13,555,Quand il noue sa ceinture  il devient plus puissant  Les Judokrak sauvages tressent leur ceinture avec des lianes 
539,Sawk,Fighting,,14,510,Es lebt zurückgezogen in den Bergen und trainiert Tag und Nacht  um seinen Karateschlag zu perfektionieren 
540,Sewaddle,Bug,Grass,3,25,Quand il éclot  Manternel lui coud son vêtement  Il dort en cachant son visage sous sa capuche 
541,Swadloon,Bug,Grass,5,73,Dans les forêts où il vit  la végétation pousse bien car il transforme les feuilles mortes en engrais 
542,Leavanny,Bug,Grass,12,205,Quand il trouve de petits Pokémon  il leur coud des vêtements de feuilles en utilisant ses coupoirs et son fil adhésif 
543,Venipede,Bug,Poison,4,53,Sa morsure est très venimeuse  Elle paralyse même les grands Pokémon Oiseaux  ses prédateurs 
544,Whirlipede,Bug,Poison,12,585,Protégé par sa solide carapace  il fonce sur ses ennemis en roulant comme un pneu 
545,Scolipede,Bug,Poison,25,2005,Il accule l’ennemi par ses mouvements rapides et l’attaque avec ses cornes  Il ne s’arrête qu’au coup de grâce 
